{
  "schema_version": "1.0",
  "as_of": "2026-04-30",
  "description": "Cross-sectional momentum ranking. No raw price data.",
  "rankings": [
    {
      "symbol": "SET:3BBIF",
      "sector": "UNKNOWN",
      "quintile": 4,
      "z_score": 0.39186742901802063,
      "rank_pct": 0.6439393939393939
    },
    {
      "symbol": "SET:AAI",
      "sector": "UNKNOWN",
      "quintile": 1,
      "z_score": -0.6983687877655029,
      "rank_pct": 0.20454545454545456
    },
    {
      "symbol": "SET:AAV",
      "sector": "UNKNOWN",
      "quintile": 2,
      "z_score": -0.6823961138725281,
      "rank_pct": 0.2196969696969697
    },
    {
      "symbol": "SET:ACE",
      "sector": "UNKNOWN",
      "quintile": 3,
      "z_score": -0.13465650379657745,
      "rank_pct": 0.42424242424242425
    },
    {
      "symbol": "SET:ADVANC",
      "sector": "UNKNOWN",
      "quintile": 4,
      "z_score": 0.7786977887153625,
      "rank_pct": 0.7878787878787878
    },
    {
      "symbol": "SET:ADVICE",
      "sector": "UNKNOWN",
      "quintile": 4,
      "z_score": 0.638405442237854,
      "rank_pct": 0.7424242424242424
    },
    {
      "symbol": "SET:AGE",
      "sector": "UNKNOWN",
      "quintile": 5,
      "z_score": 1.6789122819900513,
      "rank_pct": 0.9696969696969697
    },
    {
      "symbol": "SET:AIE",
      "sector": "UNKNOWN",
      "quintile": 3,
      "z_score": 0.14010338485240936,
      "rank_pct": 0.5227272727272727
    },
    {
      "symbol": "SET:AJ",
      "sector": "UNKNOWN",
      "quintile": 4,
      "z_score": 0.7126638889312744,
      "rank_pct": 0.7651515151515151
    },
    {
      "symbol": "SET:ALT",
      "sector": "UNKNOWN",
      "quintile": 5,
      "z_score": 0.8644332885742188,
      "rank_pct": 0.8333333333333334
    },
    {
      "symbol": "SET:AMATA",
      "sector": "UNKNOWN",
      "quintile": 5,
      "z_score": 0.8556756377220154,
      "rank_pct": 0.8257575757575758
    },
    {
      "symbol": "SET:AOT",
      "sector": "UNKNOWN",
      "quintile": 4,
      "z_score": 0.7678698301315308,
      "rank_pct": 0.7803030303030303
    },
    {
      "symbol": "SET:AP",
      "sector": "UNKNOWN",
      "quintile": 3,
      "z_score": 0.13015863299369812,
      "rank_pct": 0.5151515151515151
    },
    {
      "symbol": "SET:AS",
      "sector": "UNKNOWN",
      "quintile": 5,
      "z_score": 0.9079400897026062,
      "rank_pct": 0.8712121212121212
    },
    {
      "symbol": "SET:AURA",
      "sector": "UNKNOWN",
      "quintile": 1,
      "z_score": -0.760861873626709,
      "rank_pct": 0.1893939393939394
    },
    {
      "symbol": "SET:AWC",
      "sector": "UNKNOWN",
      "quintile": 2,
      "z_score": -0.2943769693374634,
      "rank_pct": 0.3484848484848485
    },
    {
      "symbol": "SET:BA",
      "sector": "UNKNOWN",
      "quintile": 2,
      "z_score": -0.6651017665863037,
      "rank_pct": 0.22727272727272727
    },
    {
      "symbol": "SET:BAM",
      "sector": "UNKNOWN",
      "quintile": 4,
      "z_score": 0.3478521406650543,
      "rank_pct": 0.6136363636363636
    },
    {
      "symbol": "SET:BANPU",
      "sector": "UNKNOWN",
      "quintile": 5,
      "z_score": 0.8665345311164856,
      "rank_pct": 0.8409090909090909
    },
    {
      "symbol": "SET:BBGI",
      "sector": "UNKNOWN",
      "quintile": 5,
      "z_score": 0.9031289219856262,
      "rank_pct": 0.8636363636363636
    },
    {
      "symbol": "SET:BBIK",
      "sector": "UNKNOWN",
      "quintile": 1,
      "z_score": -1.205140471458435,
      "rank_pct": 0.12878787878787878
    },
    {
      "symbol": "SET:BBL",
      "sector": "UNKNOWN",
      "quintile": 4,
      "z_score": 0.5477585196495056,
      "rank_pct": 0.696969696969697
    },
    {
      "symbol": "SET:BCH",
      "sector": "UNKNOWN",
      "quintile": 1,
      "z_score": -1.3786195516586304,
      "rank_pct": 0.09848484848484848
    },
    {
      "symbol": "SET:BCP",
      "sector": "UNKNOWN",
      "quintile": 3,
      "z_score": 0.20089901983737946,
      "rank_pct": 0.553030303030303
    },
    {
      "symbol": "SET:BCPG",
      "sector": "UNKNOWN",
      "quintile": 3,
      "z_score": -0.015618140809237957,
      "rank_pct": 0.44696969696969696
    },
    {
      "symbol": "SET:BDMS",
      "sector": "UNKNOWN",
      "quintile": 1,
      "z_score": -0.7818470001220703,
      "rank_pct": 0.17424242424242425
    },
    {
      "symbol": "SET:BEC",
      "sector": "UNKNOWN",
      "quintile": 1,
      "z_score": -2.1684467792510986,
      "rank_pct": 0.03787878787878788
    },
    {
      "symbol": "SET:BEM",
      "sector": "UNKNOWN",
      "quintile": 2,
      "z_score": -0.2965543866157532,
      "rank_pct": 0.3409090909090909
    },
    {
      "symbol": "SET:BGRIM",
      "sector": "UNKNOWN",
      "quintile": 3,
      "z_score": 0.2245272845029831,
      "rank_pct": 0.5681818181818182
    },
    {
      "symbol": "SET:BH",
      "sector": "UNKNOWN",
      "quintile": 3,
      "z_score": -0.1843288540840149,
      "rank_pct": 0.4090909090909091
    },
    {
      "symbol": "SET:BJC",
      "sector": "UNKNOWN",
      "quintile": 1,
      "z_score": -1.6743078231811523,
      "rank_pct": 0.06818181818181818
    },
    {
      "symbol": "SET:BLA",
      "sector": "UNKNOWN",
      "quintile": 4,
      "z_score": 0.5142722129821777,
      "rank_pct": 0.6818181818181818
    },
    {
      "symbol": "SET:BPP",
      "sector": "UNKNOWN",
      "quintile": 5,
      "z_score": 1.6454648971557617,
      "rank_pct": 0.9545454545454546
    },
    {
      "symbol": "SET:BTG",
      "sector": "UNKNOWN",
      "quintile": 3,
      "z_score": 0.2867256700992584,
      "rank_pct": 0.5909090909090909
    },
    {
      "symbol": "SET:BTS",
      "sector": "UNKNOWN",
      "quintile": 1,
      "z_score": -2.5949795246124268,
      "rank_pct": 0.011363636363636364
    },
    {
      "symbol": "SET:BTSGIF",
      "sector": "UNKNOWN",
      "quintile": 2,
      "z_score": -0.34211465716362,
      "rank_pct": 0.32575757575757575
    },
    {
      "symbol": "SET:CBG",
      "sector": "UNKNOWN",
      "quintile": 1,
      "z_score": -1.6905440092086792,
      "rank_pct": 0.06060606060606061
    },
    {
      "symbol": "SET:CCET",
      "sector": "UNKNOWN",
      "quintile": 2,
      "z_score": -0.3400348126888275,
      "rank_pct": 0.3333333333333333
    },
    {
      "symbol": "SET:CENTEL",
      "sector": "UNKNOWN",
      "quintile": 4,
      "z_score": 0.6527770757675171,
      "rank_pct": 0.75
    },
    {
      "symbol": "SET:CHAYO",
      "sector": "UNKNOWN",
      "quintile": 1,
      "z_score": -2.0627832412719727,
      "rank_pct": 0.05303030303030303
    },
    {
      "symbol": "SET:CHG",
      "sector": "UNKNOWN",
      "quintile": 2,
      "z_score": -0.6258310675621033,
      "rank_pct": 0.23484848484848486
    },
    {
      "symbol": "SET:CK",
      "sector": "UNKNOWN",
      "quintile": 3,
      "z_score": 0.04438989982008934,
      "rank_pct": 0.4696969696969697
    },
    {
      "symbol": "SET:CKP",
      "sector": "UNKNOWN",
      "quintile": 2,
      "z_score": -0.49941518902778625,
      "rank_pct": 0.2878787878787879
    },
    {
      "symbol": "SET:COCOCO",
      "sector": "UNKNOWN",
      "quintile": 2,
      "z_score": -0.3829724192619324,
      "rank_pct": 0.30303030303030304
    },
    {
      "symbol": "SET:COM7",
      "sector": "UNKNOWN",
      "quintile": 3,
      "z_score": 0.28329041600227356,
      "rank_pct": 0.5833333333333334
    },
    {
      "symbol": "SET:CPALL",
      "sector": "UNKNOWN",
      "quintile": 2,
      "z_score": -0.45576903223991394,
      "rank_pct": 0.29545454545454547
    },
    {
      "symbol": "SET:CPAXT",
      "sector": "UNKNOWN",
      "quintile": 1,
      "z_score": -1.5683085918426514,
      "rank_pct": 0.07575757575757576
    },
    {
      "symbol": "SET:CPF",
      "sector": "UNKNOWN",
      "quintile": 1,
      "z_score": -0.7393178343772888,
      "rank_pct": 0.19696969696969696
    },
    {
      "symbol": "SET:CPN",
      "sector": "UNKNOWN",
      "quintile": 5,
      "z_score": 0.8067864179611206,
      "rank_pct": 0.803030303030303
    },
    {
      "symbol": "SET:CPNREIT",
      "sector": "UNKNOWN",
      "quintile": 3,
      "z_score": -0.11740018427371979,
      "rank_pct": 0.4318181818181818
    },
    {
      "symbol": "SET:CRC",
      "sector": "UNKNOWN",
      "quintile": 1,
      "z_score": -0.7951632738113403,
      "rank_pct": 0.16666666666666666
    },
    {
      "symbol": "SET:DCC",
      "sector": "UNKNOWN",
      "quintile": 2,
      "z_score": -0.6847113370895386,
      "rank_pct": 0.21212121212121213
    },
    {
      "symbol": "SET:DELTA",
      "sector": "UNKNOWN",
      "quintile": 5,
      "z_score": 2.365635871887207,
      "rank_pct": 0.9962121212121212
    },
    {
      "symbol": "SET:DIF",
      "sector": "UNKNOWN",
      "quintile": 4,
      "z_score": 0.567535400390625,
      "rank_pct": 0.7045454545454546
    },
    {
      "symbol": "SET:DITTO",
      "sector": "UNKNOWN",
      "quintile": 3,
      "z_score": 0.11939872801303864,
      "rank_pct": 0.5
    },
    {
      "symbol": "SET:DMT",
      "sector": "UNKNOWN",
      "quintile": 4,
      "z_score": 0.351822167634964,
      "rank_pct": 0.6212121212121212
    },
    {
      "symbol": "SET:DOHOME",
      "sector": "UNKNOWN",
      "quintile": 1,
      "z_score": -1.1594833135604858,
      "rank_pct": 0.13636363636363635
    },
    {
      "symbol": "SET:EA",
      "sector": "UNKNOWN",
      "quintile": 5,
      "z_score": 0.8869466781616211,
      "rank_pct": 0.8560606060606061
    },
    {
      "symbol": "SET:EASTW",
      "sector": "UNKNOWN",
      "quintile": 5,
      "z_score": 1.1411411762237549,
      "rank_pct": 0.9090909090909091
    },
    {
      "symbol": "SET:EGCO",
      "sector": "UNKNOWN",
      "quintile": 4,
      "z_score": 0.4461701214313507,
      "rank_pct": 0.6590909090909091
    },
    {
      "symbol": "SET:EPG",
      "sector": "UNKNOWN",